sentence_idx,title,main,sức_mạnh,thiết_kế,giá,tính_năng,an_toàn
511,So sánh xe Suzuki Ertiga Sport 2020 và Toyota Avanza 2020: Ertiga Sport đã rẻ lại nhiều trang bị,"nếu xét về kích_thước , suzuki ertiga sport 2020 cũng như toyota_avanza 2020 đều sở_hữu kích_thước nhỏ nhất phân khúc",0,1,0,0,0
452,So sánh xe Mazda 3 2020 và Hyundai Elantra 2020: Đại chiến xe Nhật - Hàn tại Việt Nam,"với những cảm_nhận thực_tế của , dù mazda 3 2020 sedan đã tăng chiều dài trục cơ_sở 25 mm nhưng không_gian ghế ngồi hàng thứ 2 vẫn không được cải_thiện so với đời cũ",0,1,0,0,0
585,Đại chiến SUV nhập khẩu: Toyota Land Cruiser Prado 2018 hay Ford Explorer 2018 tốt hơn?,dù có kích_thước có vẻ lớn hơn đối_thủ nhưng khoảng sáng gầm xe thấp hơn và lắp_đặt khung gầm liền khối ( unibody ) lại trở_thành điểm yếu của ford_explorer trong cuộc đua khả_năng off - road với toyota_land cruiser_prado,0,1,0,0,0
69,Mua bán tải 820 triệu: Nên chọn Chevrolet Colorado 2019 hay Nissan Navara 2019?,so với colorado thì navara có phần đuôi thùng_xe vuông_vức hơn,0,1,0,0,0
365,"So sánh xe Honda Accord 2018 và Toyota Camry 2018: ""Ngựa già thay máu""","về phía accord 2018 , honda đã trang_bị công_nghệ tăng áp cho động_cơ i4 1.5 l turbocharge , đưa chiếc xe tiến tới con_số 192 mã_lực , thấp hơn một_chút so với camry",1,0,0,0,0
552,"So sánh xe VinFast Lux SA2.0 2021 và Toyota Fortuner 2021: ""Cuộc chơi"" dần thay đổi","vinfast lux sa2 . 0 là chiếc xe duy_nhất trong phân khúc sở_hữu hệ_thống ghế_ngồi bọc da nappa toát lên vẻ sang_trọng , cao_cấp",0,1,0,0,0
445,So sánh xe Mazda 2 2019 và Honda Jazz 2019: Đọ sức hatchback hạng B nhập khẩu Thái Lan ,phiên_bản cao_cấp honda jazz rs hiện có_giá bán cao hơn gần 20 triệu đồng so với bản cao_cấp se soul red_crystal của mazda 2,0,0,1,0,0
562,Toyota Land Cruise Prado 2019 có đủ sức lấy lại vị thế trước Ford Explorer?,prado vẫn bị nhiều người tiêu_dùng ô_tô tại việt_nam cho là có mức giá bán cao hơn so với những gì mà mẫu xe này mang lại,0,0,1,0,0
211,So sánh Toyota Land Cruiser Prado và Ford Explorer - Xe truyền thống và xe hiện đại,"về phía đối_thủ , ford explorer có chiều dài x rộng x cao tương_ứng là 5.036 mm x 2.004 mm x 1.778 mm , trục cơ_sở của xe dài 2.865 mm",0,1,0,0,0
376,So sánh xe Honda CR-V 2020 và Subaru Forester 2020: Hai CUV ngập tràn công nghệ tại Việt Nam,"subaru forester 2020 luôn là chiếc xe có_giá cao nhất phân khúc tại việt_nam khi dao_động trong khoảng 1,128 - 1,288 tỷ đồng cho 3 phiên_bản tùy_chọn khác nhau",0,0,1,0,0
531,So sánh xe Toyota Fortuner 2020 và Nissan Terra 2020: Thương hiệu lấn át công nghệ,nissan terra có hệ_thống đèn sương_mù được hạ thấp xuống cản dưới tương_tự đối_thủ,0,1,0,0,0
431,So sánh xe Kia Soluto và Honda City 2021: Giá bán quyết định tất cả?,"về mặt giấy_tờ , động_cơ của honda city 2021 chỉ tăng 1 mã_lực so với đời trước , nhưng lại vượt_trội hoàn_toàn so với đối_thủ",1,0,0,0,0
327,So sánh nhanh xe Honda City 2017 vs Hyundai Accent 2017,"sở_hữu dung_tích nhỉnh hơn cùng việc ứng_dụng công_nghệ i - vtec sản_sinh công_suất cũng như mô - men xoắn tốt hơn đối_thủ , do đó honda city sẽ cho bạn cảm_giác thích_thú mỗi khi nhấn ga hoặc chạy đường đối dốc ngược_lại hyundai accent tập_trung vào sự ổn_định hay nói cách khác phần đầm hơn , vì tiêu_chí họ đặt ra để giải_quyết tốt bài toán kinh_tế , tiết_kiệm nhiên_liệu",0,0,1,0,0
355,So sánh xe Chevrolet Trax 2017 và Suzuki Vitara 2016: Đại chiến SUV đô thị 800 triệu,dù có dung_tích động_cơ thấp nhưng trax vẫn có_thể tự_tin nhờ hệ_thống tăng áp độc_nhất trong phân khúc,1,0,0,0,0
159,So sánh Kia Optima và Toyota Altis 2.0,"so với thế_hệ trước , nội_thất của altis cũng đã được nâng_cấp đáng_kể , tuy_nhiên nó vẫn còn khá thô cứng , kém thanh_thoát khi so_sánh với optima",0,1,0,0,0
89,"Mua ô tô chơi tết giá 400 triệu, Hyundai Grand i10 2018 hay Mitsubishi Mirage 2017 ""ngon"" hơn?",nhìn vào thông_số trên có_thể thấy i10 hơn mirage 10 mã_lực sức_mạnh và 20nm mô - men xoắn dù dùng động_cơ dung_tích ngang nhau,1,0,0,0,0
488,So sánh xe Mitsubishi Xpander 2019 với Toyota Avanza 2019: Cuộc chiến không cân sức với Avanza,"cũng tạo_hình chữ "" l "" tương tụ đối_thủ nhưng dễ_dàng nhận ra toyota_avanza 2019 không hiện_đại bởi kích_thước tổng_thể xe nhỏ nên nhưng phần thiết_kế đều bị bó_hẹp không được giải_phóng",0,1,0,0,0
225,So sánh nhanh  KIA Morning 2019 và Toyota Wigo 2019,"bên cạnh đó , chất_lượng hoàn_thiện của kia morning cũng được nhiều khách_hàng nhận_định tốt hơn toyota_wigo , cảm_giác cao_cấp và chắc_chắn hơn",0,0,1,0,0
322,So sánh nhanh Vinfast LUX SA2.0 và Toyota Fortuner 2.8V 4x4,trang_bị_động_cơ nhỏ hơn nhưng vinfast lux sa2 . 0 cho công_suất mạnh hơn fortuner 2.8 v 4x4 tới 54 mã_lực và 10nm,1,0,0,0,0
227,So sánh nhanh Chevrolet Colorado 2017 và Ford Ranger 2017,"hàng_hóa cồng_kềnh sẽ không hề là mối lo với thùng_xe có_thể_tích tốt nhất nhì phân khúc của colorado , và để bù lại cho việc thua_thiệt về kích_thước tổng_thể của thùng hàng thì ranger có được khoảng lọt_lòng giữa hai hốc bánh_xe tốt hơn đôi_chút ( 1.150 so với 1.122 milimet ) cũng như trang_bị một nguồn sạc 12v ngay bên ngoài xe , thuận_tiện hơn cho việc sử_dụng các thiết_bị điện cầm tay khi cần_thiết",0,1,0,0,0
88,"Mua xe ô tô giá 600 triệu đồng, chọn Hyundai Accent 1.4 AT Đặc biệt hay Mazda 2 Sedan Premium 2019?",không_gian nội_thất của 2 mẫu xe đều tương_đồng về sự rộng_rãi khi chiều dài cơ_sở không hơn kém nhiều,0,1,0,0,0
64,Lựa chọn tân binh 2018: Mitsubishi Xpander 1.5 AT 2018 hay Hyundai Kona 2.0 AT 2018?,"tương_tự như kích_thước bên ngoài , khoang cabin của kona 2.0 at 2018 cũng không_thể đọ lại xpander 1.5 at 2018 với thông_số giữa cả hai lần_lượt là 2.600 mm và 2.775 mm",0,1,0,0,0
446,So sánh xe Mazda 2 2020 và Toyota Vios 2020: Cuộc chạy đua Option của xe Nhật Bản,"trong đó , giá bán cao nhất phân khúc là sự đánh_đổi khó_khăn nhất bởi mức giá 649 triệu đồng cho bản cao_cấp thì một_số lựa_chọn xe hạng c đã nằm trong tầm tay",0,0,1,0,0
535,So sánh xe Toyota Granvia 2020 và Kia Sedona 2020: Cuộc cạnh tranh xe dịch vụ chuyên chở cao cấp,dù cùng cạnh_tranh với các đối_thủ nhưng toyota_granvia lại có những điểm nhấn khác_biệt đến từ cấu_hình 9 chỗ ngồi thay_vì 7 và mức giá cũng cao hơn đáng_kể,0,0,1,0,0
218,So sánh VinFast LUX A 2021 và Toyota Camry 2021: chọn cảm giác lái hay bền bỉ?,"thông_số này ở mẫu xe đối_thủ toyota_camry 2.0 g 2021 : 4.885 x 1.840 x 1.445 mm , chiều dài cơ_sở 2.825 mm , khoảng sáng gầm xe 140mm",0,1,0,0,0
525,So sánh xe Toyota Corolla Cross 2020 và Honda CR-V 2020: Cuộc chiến công nghệ,"ở kích_thước tổng_thể , toyota_corolla cross 2020 không thua_kém nhiều đối_thủ , đặc_biệt ở chiều dài cơ_sở với những thông_số như sau : toyota_corolla cross 2020 được phát_triển dựa trên rav4 nên khi nhìn phần đầu , người dùng sẽ nhận ra nhiều nét quen_thuộc",0,1,0,0,0
584,"Đại chiến Nhật -Hàn:Toyota Corolla Altis 2017 và Kia Cerato 2017, nên mua xe nào?",dù_vậy yếu điểm của xe trước đối_thủ corolla là đèn_pha dạng halogen,0,0,0,1,0
374,"So sánh xe Honda CR-V 2020 và Baic Beijing X7 2020: Khi ""vua"" phân khúc bị đe dọa","hơn_nữa , baic beijing x7 cũng sử_dụng bộ la - zăng lớn hơn đối_thủ là 19 inch cùng thiết_kế dạng 2 tông màu khác_biệt",0,1,0,0,0
146,So sánh Hyundai i10 2021 và Vinfast Fadil 2021,"cả 2 xe đều được lắp_ráp trong nước theo dạng ckd với giá bán đề_xuất của các phiên_bản lần_lượt là : có_thể thấy , giá đề_xuất của fadil cao hơn khá nhiều so với i10 , gần chạm ngưỡng nhiều mẫu sedan hạng b",0,0,1,0,0
537,So sánh xe Toyota Hilux 2019 và Chevrolet Colorado 2019: Đại chiến bán tải Nhật - Mỹ,"bởi lẽ dù có_giá bán rẻ hơn tới gần 60 triệu đồng nhưng colorado vẫn thể_hiện sự bứt_phá ở nhiều mảng , ví_dụ như nội_thất rộng_rãi hơn , hệ_thống giải_trí hiện_đại và loạt tính_năng an_toàn hấp_dẫn",0,0,1,0,0
511,So sánh xe Suzuki Ertiga Sport 2020 và Toyota Avanza 2020: Ertiga Sport đã rẻ lại nhiều trang bị,"hai mẫu xe cùng đến từ nhật_bản này có sự cải_tiến ở một_số chi_tiết , trong đó avanza còn được bổ_sung_công_nghệ đèn_chiếu sáng tốt hơn đối_thủ",0,0,0,1,0
212,So sánh Toyota Raize 2022 và Kia Sonet 2022: Lựa chọn tiện nghi hay sự thực dụng ?,"mặc_dù vậy , kia sonet chỉ có chiều dài cơ_sở 2.500 mm , ngắn hơn đối_thủ toyota_raize có trục cơ_sở 2.525 mm",0,1,0,0,0
213,So sánh Toyota Vios 2014 và Chevrolet Cruze trong tầm giá 700 triệu,cruze với chiều dài cơ_sở là 2.685 mm ( lớn hơn cả altí 2014 chỉ 2.600 mm ) lại là sedan hạng trung thì việc lớn hơn vios có chiều dài cơ_sở chỉ 2.550 mm là điều hiển_nhiên,0,1,0,0,0
552,"So sánh xe VinFast Lux SA2.0 2021 và Toyota Fortuner 2021: ""Cuộc chơi"" dần thay đổi","bên kia chiến_tuyến , toyota_fortuner 2021 đã rũ bỏ thiết_kế già_cỗi , thay vào đó là "" gương_mặt "" đầy sức_sống và trẻ_hóa hoàn_toàn so với đời cũ",0,1,0,0,0
197,So sánh Peugeot 2008 GT Line 2021 và Toyota Corolla Cross 1.8V 20201: Hơn 800 triệu chọn xe nào?,"điểm_trừ của peugeot 2008 là điểm cộng của corolla_cross khi xe cung_cấp đủ cho khách_hàng sự thoải_mái , các tiện_ích như cửa gió điều hòa , bệ tỳ tay và tựa đầu",0,0,0,1,0
183,So sánh Mitsubishi Pajero Sport 4x2 và Toyota Fortuner Legender 4x2 ,"về an_toàn , pajero sport 4x2 hoàn_toàn vượt_trội hơn fortuner với khả_năng chống tăng_tốc ngoài ý_muốn",0,0,0,0,1
322,So sánh nhanh Vinfast LUX SA2.0 và Toyota Fortuner 2.8V 4x4,"hiện_tại cả 2 mẫu suv đều được lắp_ráp trong nước với giá bán như sau : với giá bán như trên , lux sa2 . 0 đắt hơn so với fortuner 2.8 v 4x4 60 triệu đồng",0,0,1,0,0
452,So sánh xe Mazda 3 2020 và Hyundai Elantra 2020: Đại chiến xe Nhật - Hàn tại Việt Nam,"bằng_chứng là honda_civic , toyota_corolla altis giá cao nhất hơn 900 triệu đồng và luôn lọt top xe bán chậm trong phân khúc",0,0,1,0,0
22,Chọn SUV 7 chỗ nào giữa Ford Everest 2019 và Mitsubishi Pajero Sport 2019?,"mang bộ lazang có kích_thước lớn hơn hẳn , có kích_thước lên đến 20 inch thay_vì 18 inch của pajero sport giúp cho mẫu xe_nước mỹ mang đến sự mạnh_mẽ và cơ_bắp hơn so với suv nước nhật",0,1,0,0,0
131,So sánh Honda Civic 2021 và KIA Cerato 2021,kia cerato 2.0 premium trang_bị hệ_thống đèn_pha hiện_đại hơn đối_thủ,0,0,0,1,0
273,So sánh nhanh Hyundai i10 2021 và Honda Brio 2021,"có_thể thấy , giá bán dễ_chịu hơn đôi_chút kèm danh_sách trang_bị tiện_nghi - an_toàn tốt hơn thì hyundai i10 1.2 at chính là sự lựa_chọn phù_hợp cho những người mong_muốn tìm một chiếc xe hạng a "" chịu_chơi "" hơn , đề_cao tính trải nghiệm , hưởng_thụ và ít quan_tâm tới yếu_tố về mặt thương_hiệu , giá_trị bán lại",0,0,1,0,0
383,So sánh xe Honda City RS 2021 và Toyota Vios GR-S 2021: Chọn xe sedan thể thao nào?,"phong_cách thể_thao thể_hiện rõ trên mẫu xe này ngoại phần ngoại_hình trẻ_trung , nội_thất ấn_tượng và khả_năng vận_hành vượt_trội so với phân khúc",1,0,0,0,0
246,So sánh nhanh Honda CR-V 2020 và Subaru Forester 2020,"về thông_số kích_thước , subaru forester 2020 vượt_trội khá nhiều so với đối_thủ bán_chạy",0,1,0,0,0
587,"Đắt hơn 200 triệu, liệu Honda Civic 2018 có thực sự tốt hơn Chevrolet Cruze 2018?","nhìn qua về giá bán thì có_thể thấy giá đắt hơn chevrolet_cruze rất nhiều , thậm_chí phiên_bản thấp giá nhất của chiếc xe nhật cũng đắt hơn bản cao_cấp nhất của mẫu xe mỹ",0,0,1,0,0
11,Chạy dịch vụ nên mua Ford Transit hay Hyundai Solati để tiết kiệm nhất?,solati dù không có nhiều tính_năng an_toàn hấp_dẫn như đối_thủ nhưng bù lại có thêm 2 túi khí,0,0,0,0,1
407,"So sánh xe Hyundai SantaFe 2016 và Ford Everest 2016: Đâu là SUV 1,3 tỷ tốt nhất?","về kích_thước xe , mẫu xe mỹ tỏ rõ lợi_thế khi vượt_trội hơn đối_thủ 202mm chiều dài , 157mm chiều cao và 150mm chiều dài cơ_sở",0,1,0,0,0
442,"So sánh xe MG ZS 2021 và Ford EcoSport 2021: ""Tân binh"" đủ sức thay thế ""cựu vương""","bộ mâm dạng cánh hoa 17 inch được giữ nguyên từ "" người tiền_nhiệm """,0,1,0,0,0
347,So sánh xe Chevrolet Aveo và Mitsubishi Attrage - Đại chiến xe hạng B giá rẻ,"ghế_ngồi bọc nỉ , thoải_mái dù chiều dài cơ_sở có ngắn hơn so với nhiều đối_thủ cùng phân khúc",0,1,0,0,0
473,So sánh xe Mercedes-Benz C200 2019 và BMW 3-Series,"dù_vậy , giá bán của thương_hiệu ngôi_sao 3 cánh vẫn thấp hơn đối_thủ , khiến nó hấp_dẫn hơn với khách việt",0,0,1,0,0
212,So sánh Toyota Raize 2022 và Kia Sonet 2022: Lựa chọn tiện nghi hay sự thực dụng ?,"trong khi đó , kia_sonet với mức giá cao nên kém sức hút hơn và không gặp tình_trạng chờ_đợi như đối_thủ",0,0,1,0,0
51,"Hatchback hạng B dưới 650 triệu đồng, chọn Toyota Yaris 1.5 G 2018 hay Honda Jazz RS 2018?","giá xe toyota_yaris 1.5 g 2018 mới được niêm_yết ở mức 650 triệu đồng , đắt hơn so với mức giá 642 triệu đồng của phiên_bản cũ",0,0,1,0,0
8,Chevrolet Spark 2019 và Vinfast Fadil 2019 giống và khác nhau ở đâu?,"chiếc xe việt_nam có trang_bị tốt hơn , động_cơ linh_hoạt hơn , thiết_kế đẹp hơn",1,1,0,1,0
28,Chọn crossover 7 chỗ nào Honda CR-V 2018 hay Nissan X-Trail 2018?,khả_năng xử_lý tay_lái của cr - v tốt hơn x - trail với sự cân_bằng giữa cảm_giác thoải_mái và tính nhanh_nhạy,0,0,1,0,0
420,"So sánh xe Kia Optima và Mazda6 - Hai ""bại binh"" trở lại","xét về kích_thước , cả 2 mẫu xe đều không có nhiều chênh_lệch về thông_số , tuy_nhiên mazda6 vẫn có lợi_thế rõ_ràng hơn nhờ khoảng sáng gầm xe cao hơn 15mm",0,1,0,0,0
50,Gia đình trẻ chọn Hyundai Accent 2019 hay Honda City 2019?,"ngoài_ra , khoảng sáng gầm xe của mẫu xe hàn_đạt 150mm , lợi_thế hơn khá nhiều so với con_số 135mm trên honda_city",0,1,0,0,0
170,So sánh Mazda CX-5 2.0 Deluxe và Toyota Corolla Cross 1.8V,"về an_toàn , với lợi_thế_là phiên_bản giữa của dòng sản_phẩm , corolla cross 1.8 v hoàn_toàn vượt_trội so với cx - 5 2.0 deluxe",0,0,0,0,1
475,So sánh xe Mercedes-Benz GLC 300 2020 và BMW X3 2020,"so với bản cũ , động_cơ trên glc 300 mới mạnh hơn 13 mã_lực , mô - men xoắn được giữ nguyên cùng hộp_số tự_động 9 cấp 9g - tronic và hệ_thống dẫn_động 4matic",1,0,0,0,0
239,So sánh nhanh Honda Accord 2019 và Peugeot 508 2019,"peugeot 508 nhập_khẩu từ pháp , 1 phiên_bản với mức giá 1,379 tỷ đồng , đắt hơn đối_thủ 176 triệu",0,0,1,0,0
554,So sánh xe Volkswagen Passat và Renault Latitude - Phong cách Châu Âu hội tụ,"đặt cạnh passat , mẫu xe pháp có chiều dài và chiều cao lớn hơn tương_ứng 130mm và 27mm",0,1,0,0,0
210,So sánh Toyota Hilux 2016 và Mazda BT-50 2016: Liệu có cân sức?,"bên cạnh đó , kích_thước thùng_xe của hilux 2016 rộng hơn đối_thủ 60mm còn bt - 50 2016 lại có thùng cao hơn 23mm",0,1,0,0,0
376,So sánh xe Honda CR-V 2020 và Subaru Forester 2020: Hai CUV ngập tràn công nghệ tại Việt Nam,vô - lăng trên honda cr - v được thiết_kế bắt_mắt hơn với chất_liệu bọc da với khả_năng cầm nắm vừa_vặn,0,1,0,0,0
577,"Với tầm giá xấp xỉ một tỷ đồng, chọn Mazda 6 2019 hay Kia Optima 2019","về mặt tổng_thể , đuôi xe của mazda 6 mang đến nhiều ấn_tượng hơn so với kia_optima với phần đèn được thiết_kế sắc nét và nổi_bật với thanh crome chạy dài nối_liền hai bên",0,1,0,0,0
207,So sánh Toyota Camry và Volkswagen Passat: Hai thái cực đối lập trong phân khúc sedan hạng D,"về kích_thước , passat nhỉnh hơn 16mm chiều dài cơ_sở và 7mm chiều rộng so với đối_thủ , bù lại , toyota_camry lại vượt_trội về chiều dài ( hơn passat 83mm ) và 14mm về chiều cao",0,1,0,0,0
152,So sánh Kia Cerato 2019 và Honda Civic 2019,"mẫu xe hàn_quốc có phần chiếm ưu_thế hơn về thiết_kế nội_thất với sự bố_trí hiện_đại , tiện_nghi",0,1,0,0,0
54,Hyundai Sonata 2018 và Kia Optima 2018: Chọn sedan cỡ trung nào?,"mặc_dù có thiết_kế tương_tự về động_cơ , nhưng sonata 2018 xuất_sắc hơn về khía_cạnh thiết_kế , khả_năng điều_khiển và tiết_kiệm nhiên_liệu",1,1,0,1,0
345,So sánh xe Baic X55 và Hyundai Tucson 2021: Đại chiến xe CUV giá rẻ,"với baic x55 , mẫu xe này có lợi_thế cạnh_tranh nhờ mức giá rẻ nhất phân khúc , trang_bị ở mức đủ dùng",0,0,1,0,0
219,"So sánh VinFast LUX A2.0 và Mazda 6: Tân binh Việt Nam thách thức ""anh tài"" nước Nhật","cụm đèn hậu của mẫu xe việt_nam có phần kém nổi_bật hơn so với những đường_nét sắc_sảo , giữ dằn trên đèn hậu của mazda 6 2018",0,1,0,0,0
410,So sánh xe Hyundai SantaFe và Toyota Fortuner: Cuộc chiến Nhật - Hàn giành ngôi vương trong phân khúc SUV,"tuy_nhiên , về mặt tổng_thể , fortuner có phần "" đuối "" hơn santafe về nhiều mặt từ thiết_kế , trang_bị tới vận_hành",1,1,0,1,0
53,"Hyundai Santa Fe 2017 và Toyota Fortuner 2017: Chọn Santa Fe rẻ và ""lãi""","về màu sơn , hyundai santafe có chút lợi_thế hơn khi sở_hữu tận 6 tùy_chọn màu ngoại_thất , gồm trắng , bạc , đỏ , vàng cát , vàng be , đen , còn toyota_fortuner hiện mới có 5 màu trắng , nâu , xám , đen và bạc",0,1,0,0,0
56,Hơn 800 triệu đồng chọn Hyundai Tucson 2020 hay Toyota Corolla Cross 2020?,"so với đối_thủ , tucson thiếu camera quan_sát phía trước , bởi đơn_giản chiếc xe này không có gói an_toàn camera 360 độ",0,0,0,0,1
344,"So sánh xe Baic Beijing X7 2020 và Hyundai Tucson 2020: ""Tân binh"" mới nổi thách thức ""lão làng""",điểm mạnh nhất của baic beijing x7 2020 đến từ những trang_bị tiện_nghi dẫn_đầu phân khúc cuv hạng c tại việt_nam,0,0,0,1,0
45,"Cùng giá 499 triệu đồng, nên chọn Hyundai Accent 1.4AT hay Kia Cerato SMT?","kia cerato smt 2018 là xe hạng c , chính vì_thế kích_thước lớn hơn đã mang lại lợi_thế cho cerato so với đối_thủ hyundai accent 1.4 at",0,1,0,0,0
477,So sánh xe Mitsubishi Attrage 2020 và Kia Soluto 2019: Ngang tài ngang sức,"với giá bán chỉ cao hơn 5 triệu đồng , chiếc xe mang thương_hiệu nhật_bản đang chiếm ưu_thế hơn so với đối_thủ hàn_quốc vốn đang thành_công_bằng chiến_lược giá rẻ nhiều option",0,0,1,0,0
382,So sánh xe Honda City 2021 và Hyundai Accent 2021 ,"về không_gian , kích_thước nhỉnh hơn cùng với khả_năng tối_ưu không_gian rất tốt của honda giúp city 2021 duy_trì lợi_thế_là mẫu xe rộng_rãi hàng_đầu phân khúc",0,1,0,0,0
196,So sánh Nissan Terra 2018 và Toyota Fortuner 2018: Liệu tân binh có làm nên chuyện?,"mức giá này thực_sự khá cao nếu đặt cạnh fortuner , thậm_chí khiến chiếc suv trở_nên đắt quá tầm so với phân khúc",0,0,1,0,0
250,So sánh nhanh Honda City và Suzuki Ciaz,"cảm_giác lái , hẳn_nhiên ciaz khó mà qua được city khi mà honda đầu_tư yếu_tố này rất nhiều , hơn hẳn các đối_thủ cùng phân khúc",0,0,1,0,0
396,So sánh xe Hyundai Accent 2021 và Toyota Vios 2021: Chọn công nghệ hay ăn chắc mặc bền?,"do có chiều dài trục cơ_sở nhỉnh hơn 50mm nên so với đối_thủ , hyundai_accent mang lại không_gian thoải_mái hơn cho các hành_khách",0,1,0,0,0
40,"Có 1,2 tỷ, nên mua BMW 5 Series 2018 hay Audi A6 2018?",♦ ♦ ♦ ♦ a6 và 5 series sở_hữu không ít trang_bị nội_thất thuộc vào hàng tinh_tế nhất phân khúc,0,1,0,0,0
53,"Hyundai Santa Fe 2017 và Toyota Fortuner 2017: Chọn Santa Fe rẻ và ""lãi""","dù_vậy , santafe lại cung_cấp nhiều túi khí hơn hẳn khi ở các phiên_bản cao_cấp hơn , ngoài_ra là thêm cả phanh tay điện_tử để giúp quá_trình đỗ xe an_toàn hơn",0,0,0,0,1
286,So sánh nhanh Mazda3 2020 và Hyundai Elantra 2020,"bảng thông_số về kích_thước xe cho thấy , mazda3 có trục cơ_sở và chiều dài tổng_thể lớn hơn so với elantra nhưng lại kém hơn về chiều rộng và chiều cao",0,1,0,0,0
408,"So sánh xe Hyundai SantaFe 2016 và Mazda CX-5 2016: Đại chiến SUV 1,1 tỷ","còn về đối_thủ mazda cx - 5 , chiếc xe sở_hữu ngoại_thất tương_đối trẻ_trung và năng_động , vẫn trung_thành với triết_lý “ kodo – linh_hồn chuyển_động ”",0,1,0,0,0
383,So sánh xe Honda City RS 2021 và Toyota Vios GR-S 2021: Chọn xe sedan thể thao nào?,"ở phía sau , cụm đồng_hồ của vios gr - s dạng màu đỏ thể_thao hơn và màn_hình tft 4,2 inch lớn hơn",0,0,0,1,0
521,"So sánh xe Toyota Corolla Altis 2019 và Mazda 3 2020: Cơ hội nào cho ""cựu vương""?","tuy rẻ hơn nhưng mazda 3 2020 1.5 l deluxe hiện_đại hơn nhờ hệ_thống đèn_pha full led hiện_đại , tích_hợp chức_năng tự_động bật tắt , tự_động cân_bằng góc chiếu và đèn chạy ban_ngày",0,0,1,0,0
141,So sánh Hyundai SantaFe 2019 và Mitsubishi Pajero Sport 2019,"xét về khả_năng vận_hành , mitsubishi pajero sport được xem là vượt_trội hơn so với hyundai santafe 2019",1,0,0,0,0
458,So sánh xe Mazda 6 2020 và Honda Accord 2020: Đại chiến xe Nhật,"trong khi đó , rõ_ràng màn "" ve_sầu lột_xác "" của honda accord 2020 hẳn đã khiến người tiêu_dùng hài_lòng với một mẫu xe có_giá bán cao nhất phân khúc tính đến thời_điểm này",0,0,1,0,0
164,"So sánh Lexus LX 570 2018 và Land Rover Range Rover 2018: Chuẩn mực SUV của ""giới đại gia"" Việt","đuôi xe của range rover 2018 có phần kém nổi_bật hơn với thiết_kế cụm đèn hậu vuông_vức "" hiền_lành "" xếp gọn hai bên",0,1,0,0,0
446,So sánh xe Mazda 2 2020 và Toyota Vios 2020: Cuộc chạy đua Option của xe Nhật Bản,"toyota_vios 2020 chỉ thua mazda 2 ở những công_nghệ_cao_cấp về khả_năng an_toàn , còn mức giá và độ phủ trong phân khúc đã "" ăn_đứt "" đối_thủ từ khá lâu",0,0,1,0,0
230,So sánh nhanh Chevrolet Cruze 2017 và Kia Cerato 2017,"một lần nữa kia cerato 2017 lại vượt_trội hơn hẵn đối_thủ với đầy_đủ các tính_năng an_toàn , trong khi chevy cruze 2017 chỉ được trang_bị an_toàn nhỉnh hơn những mẫu xe hạng b",0,0,0,0,1
497,So sánh xe Nissan Terra 2019 và Ford Everest 2019: Tiền nào của nấy,"trong khi đó vì có khoảng sáng gầm xe lớn hơn đối_thủ nên terra vượt địa_hình tốt hơn everest , chưa kể lốp của chiếc xe nhật có thông_số 255 / 60r18 , dày hơn mẫu 265 / 50r20 của everest nên sẽ cho cảm_giác êm_ái hơn",0,0,1,0,0
102,"SUV đô thị cỡ nhỏ dưới 800 triệu, chọn Hyundai Kona 2019 hay Suzuki Vitara 2018?","xét về tính_năng an_toàn , hyundai_kona 2019 được trang_bị nhiều công_nghệ hiện_đại hơn một_chút so với suzuki vitara 2018",0,0,0,1,0
138,So sánh Hyundai Kona 2020 và Honda HR-V 2020,"danh_sách trang_bị an_toàn trên 2 mẫu xe đều có những tính_năng hiện_đại và cần_thiết , nhưng nhìn_chung kona vẫn nhỉnh hơn",0,0,0,0,1
