sentence_idx,title,main,sức_mạnh,thiết_kế,giá,tính_năng,an_toàn
553,So sánh xe Vinfast LUX SA2.0 2019 và Toyota Fortuner 2019: Xe Việt đại thắng,"như_vậy , không còn nghi_ngờ gì khi nói rằng vinfast sa2 . 0 có thực_lực hoàn_toàn vượt xa đối_thủ toyota_fortuner về mọi mặt như độ rộng_rãi , công_nghệ , trang_bị cho tới vận_hành",1,1,0,1,0
464,"So sánh xe Mazda CX-5 2019 và Subaru Forester 2019: Kẻ đầy ắp công nghệ, kẻ đề cao sự mạnh mẽ","còn nội_thất subaru_forester 2019 đơn_giản nhưng toát lên sự mạnh_mẽ , thể_thao , thể_hiện đẳng_cấp cạnh_tranh không thua_kém các đối_thủ trong cùng phân khúc",0,1,0,0,0
406,So sánh xe Hyundai Santa Fe 2021 và Ford Everest 2021: chọn tiện nghi hay sự rộng rãi?,"mẫu suv mỹ có chiều dài nhỉnh hơn đối_thủ 107mm , cao hơn 107mm và trục cơ_sở dài hơn 85mm",0,1,0,0,0
129,So sánh Honda City L 2021 và Toyota Vios G 2021: chọn thực dụng hay theo xu hướng?,"nhờ sử_dụng nền_tảng khung gầm mới , honda city 2021 đã có kích_thước dài , rộng hơn đáng_kể , góp_phần tạo ra một không_gian nội_thất có_thể nói là rộng_rãi nhất phân khúc",0,1,0,0,0
316,So sánh nhanh Toyota Hilux 2021 và Mitsubishi Triton 2021,"kích_thước thùng_xe của mitsubishi triton theo dài x rộng x cao là 1.520 x 1.470 x 475 ( mm ) , còn toyota_hilux là 1.512 x 1.524 x 482 ( mm ) , rộng và cao hơn triton",0,1,0,0,0
191,So sánh Mitsubishi Xpander AT 2021 và Toyota Innova 2.0G 2021: Cuộc cạnh tranh xe chạy dịch vụ tại Việt Nam,"mitsubishi xpander có lợi_thế về thiết_kế trẻ_trung , nội_thất 7 chỗ đủ dùng và quan_trọng nhất là mức giá rẻ hơn 200 triệu đồng so với phiên_bản tương_tự của đối_thủ",0,0,1,0,0
284,So sánh nhanh Mazda CX-5 2019 và Peugeot 3008 2019,"có_giá_thành cao hơn , peugeot sử_dụng màn_hình hiển_thị thông_số kỹ_thuật 12,4 - inch dạng digital , hiện_đại và cá_tính hơn so với kiểu analog ở cx - 5",0,0,1,0,0
409,So sánh xe Hyundai SantaFe 2017 và Nissan X-Trail 2017: Xe Hàn - Nhật so tài,"về thông_số vận_hành , nissan x - trail sử_dụng động_cơ qr25de 2.5 l , cho công_suất tương_đương đối_thủ",1,0,0,0,0
490,So sánh xe Mitsubishi Xpander 2020 và Suzuki Ertiga Sport 2020: Nâng cấp để tiếp tục cuộc chiến,nhờ các thông_số kích_thước của xpander đều vượt_trội hơn hẳn so với ertiga sport nên không khó để nhận ra sự khác_biệt ấy từ phần thân,0,1,0,0,0
178,So sánh Mitsubishi Attrage với Chevrolet Aveo,"với mức giá cao hơn , mitsubishi attrage là chiếc xe được trang_bị nhiều tiện_nghi an_toàn hơn",0,0,1,0,0
431,So sánh xe Kia Soluto và Honda City 2021: Giá bán quyết định tất cả?,"tuy_nhiên , nhược_điểm sẽ đến từ mức giá cao nhất phân khúc , gần 600 triệu đồng cho phiên_bản cao_cấp nhất",0,0,1,0,0
538,"So sánh xe Toyota Hilux Adventure 2020 và Ford Ranger Wildtrak 2020: Ngang tài, ngang sức","nhìn_chung , cả toyota_hilux adventure 2020 hay ford ranger wildtrak 2020 đều là những chiếc xe bán tải có khả_năng vận_hành ấn_tượng",1,0,0,0,0
377,So sánh xe Honda CR-V 2021 và Mitsubishi Outlander 2021,"ở thế_hệ 2021 , cr - v mới đã trở về với hình_thức lắp_ráp trong nước theo dạng ckd , giá bán các phiên_bản lần_lượt như sau : tương_tự , outlander 2021 cũng được phân_phối theo hình_thức lắp_ráp ckd nhưng khoảng giá được mở_rộng , qua đó tiếp_cận được nhiều đối_tượng khách_hàng hơn : bài viết này sẽ tập_trung so_sánh trang_bị của hai phiên_bản có mức giá đề_xuất tương_đương là cr - v 1.5 g cvt và outlander 2.4 cvt premium",0,0,1,0,0
52,Honda CR-V 2018 và Ford Escape 2018: Crossover nào tốt nhất khi mua ở Việt Nam?,"honda cr - v 2018 tiêu_chuẩn dành cho thị_trường mỹ đi kèm với động_cơ 4 xi_lanh dung_tích 2,4 lít cho 184 mã_lực , khá ổn so với việc lái_xe thường_ngày",1,0,0,0,0
174,So sánh Mercedes-Benz C200 2019 và Toyota Camry 2019: Đại chiến xe sang Đức - Nhật,dù thực_tế chỉ có c200 mới là xe sang thực_thụ nhưng camry cũng được nhiều người coi như 1 thương_hiệu hạng sang bởi mức giá bán cao và vẻ ngoài bắt_mắt,0,0,1,0,0
474,So sánh xe Mercedes-Benz E 300 AMG 2020 với Lexus ES 250 2020,"bằng việc tăng hầu_hết thông_số kích_thước xe và hạ thấp trọng_tâm , lexus es 250 2020 sẽ có khả_năng vận_hành tốt hơn",1,0,0,0,0
27,Chọn SUV đẳng cấp nào giữa BMW X7 2019 và Lexus LX570 2019? ,"xe có một màn_hình hiển_thị đa_phương_tiện 12.3 inch cảm_ứng hiện_đại , hỗ_trợ định_vị gps , kích_thước lớn vừa sang_trọng vừa hiển_thị nhiều thông_tin hơn",0,1,0,0,0
585,Đại chiến SUV nhập khẩu: Toyota Land Cruiser Prado 2018 hay Ford Explorer 2018 tốt hơn?,"về phía ford_explorer , xe cho cảm_giác nam_tính nhưng trẻ_trung hơn hẳn đối_thủ nhật_bản",0,0,1,0,0
531,So sánh xe Toyota Fortuner 2020 và Nissan Terra 2020: Thương hiệu lấn át công nghệ,toyota_fortuner 2020 dù không sở_hữu nhiều công_nghệ an_toàn và mức giá bán cao bậc nhất phân khúc nhưng lại có lợi_thế thương_hiệu cùng thiết_kế mềm_mại và ưa_nhìn,0,0,1,0,0
124,So sánh Honda Brio 2018 và Toyota Wigo 2018: Đại chiến tân binh hạng A,"các chuyên_gia dự_đoán rằng , chiếc xe này sẽ có_giá vào tầm 400 triệu khi về việt_nam , tương_tự như các mẫu xe khác thuộc phân khúc xe hạng a",0,0,1,0,0
471,So sánh xe Mercedes V-Class 2019 và Peugeot Traveller 2019: Nên mua MPV hạng sang nào cho phải?,"về cơ_bản , động_cơ của traveller khó có_thể mạnh_mẽ được như v - class",1,0,0,0,0
20,"Chọn Mercedes-Benz C 180 2020 hay Toyota Camry 2020: Hơn 1,5 tỷ đồng và sự chấp chới giữa xe sang và bình dân","nếu thực_tế nhìn cả 2 mẫu xe này ngoài đời , tôi tin chắc bạn không nghĩ kích_thước toyota_camry 2020 chỉ nhỉnh hơn đôi_chút so với đối_thủ đến từ đức",0,1,0,0,0
205,So sánh Toyota Camry 2.5Q thế hệ mới và thế hệ cũ tại Việt Nam,"tương_tự như ngoại_thất , nội_thất của camry đã được cách_tân gần như hoàn_toàn với sự bố_trí đơn_giản hơn nhưng sang_trọng và hiện_đại hơn",0,1,0,0,0
46,"Cùng tầm 1 tỷ, Honda CR-V 1.5 L và Nissan X-Trail V-Series 2.5 SV Luxury hơn kém nhau ra sao?","tuy_nhiên , honda cr - v 1.5 l có phần nhỉnh hơn về khả_năng vận_hành khi sở_hữu sức_mạnh mạnh_mẽ nhất phân khúc và không_gian bên trong yên_tĩnh nhờ vào tính_năng chủ_động kiểm_soát tiếng ồn",1,0,0,0,0
197,So sánh Peugeot 2008 GT Line 2021 và Toyota Corolla Cross 1.8V 20201: Hơn 800 triệu chọn xe nào?,"xét về thông_số kích_thước , toyota_corolla cross rỏ ra hoàn_toàn vượt_trội so với đối_thủ và nhìn từ thân , chiếc xe đến từ nhật_bản cũng bề_thế hơn rõ_rệt",0,1,0,0,0
530,So sánh xe Toyota Fortuner 2018 và Peugeot 5008 2018: Ông hoàng và tân binh,"xét về kích_thước , toyota_fortuner có vẻ to_lớn hơn đối_thủ một_chút , cụ_thể là dài hơn 5008 125mm và cao hơn đối_thủ 180mm",0,1,0,0,0
218,So sánh VinFast LUX A 2021 và Toyota Camry 2021: chọn cảm giác lái hay bền bỉ?,với những thông_số như trên thì chúng_ta cũng dễ_dàng nhận ra khả_năng vận_hành của vinfast lux a base 2021 mạnh_mẽ và chiếm ưu_thế hơn hẳn so với toyota_camry 2.0 g 2021,1,0,0,0,0
256,So sánh nhanh Hyundai Accent 2021 và Mitsubishi Attrage 2021,"các thông_số về kích_thước đều cho thấy hyundai accent có chiều dài tổng_thể và chiều rộng_lớn hơn , giúp mang lại không_gian cabin rộng_rãi , dễ_chịu hơn , đặc_biệt là ở hàng ghế sau",0,1,0,0,0
14,"Chọn Hyundai SantaFe 2019 kèm theo ""lạc"" hay Peugeot 5008 2019?","về tổng_thể , kiểu thiết_kế vô_lăng chỉ có hai chấu cộng với phần vàng lái không tròn đều của peugeot 5008 mang đến cảm_giác ấn_tượng hơn so với kiểu thiết_kế vô_lăng 3 chấu và vành lái tròn đều của santafe",0,0,1,0,0
148,So sánh Isuzu mu-X và Toyota Fortuner,"mọi thông_số kích_thước của mu - x đều nhỉnh hơn fortuner 2014 , từ “ số_đo ba vòng ” cho đến khoảng_cách hai cầu và khoảng sáng gầm , ngay cả bán_kính quay_vòng cũng tốt hơn dù mu - x sở_hữu thân_hình cồng_kềnh hơn",0,1,0,0,0
542,"So sánh xe Toyota Rush và Toyota Avanza: ""Gà nhà đá nhau"" trong tầm giá 700 triệu","toyota_rush rộng hơn 1 chút với chiều dài cơ_sở 2695mm , vậy nên khu_vực để chân của chiếc suv cũng rộng_rãi hơn đối_thủ",0,1,0,0,0
394,So sánh xe Hyundai Accent 2015 và Honda City 2016: Mỗi người một vẻ,"về trang_bị an_toàn , honda city 2016 thể_hiện sự trội hơn so với hyundai accent 2015 khi có danh_sách các trang_bị an_toàn dài hơn",0,0,0,0,1
210,So sánh Toyota Hilux 2016 và Mazda BT-50 2016: Liệu có cân sức?,"nếu xét về kích_thước , mazda bt - 50 2016 có lợi_thế hơn nhờ chiều dài , chiều cao và chiều dài cơ_sở đều hơn đối_thủ lần_lượt là 35mm , 5mm và 135 mm",0,1,0,0,0
236,So sánh nhanh Ford Everest 2021 và Mitsubishi Pajero Sport 2021,"đặc_biệt , trang_bị gói an_toàn mitsubishi_e - assist giúp mẫu xe này không còn thua_kém các đối_thủ về mắt công_nghệ",0,0,0,0,1
311,So sánh nhanh Toyota Corolla Cross 2020 và Mazda CX-5 2020,"từ đó , giá lăn bánh của toyota_corolla cross 2020 có phần cao hơn đôi_chút",0,0,1,0,0
73,"Mua xe bán tải mới, chọn Mitsubishi Triton MIVEC 4x4 AT 2019 hay Ford Ranger Wildtrak 4x4 AT 2018?",thùng_xe của ranger có khả_năng chứa nhiều đồ_dùng hơn hẳn so với triton khi sở_hữu kích_thước 1.450 x 1.560 x 450 mm,0,1,0,0,0
563,"Tân binh Ford Ranger Raptor đọ sức với ""đàn anh"" Ford Ranger Wildtrak 4x4 AT",ford ranger raptor mới ra_mắt việt_nam tại triển_lãm ô_tô vms 2018 có kích_thước tổng_thể lớn hơn phiên_bản wildtrak 4x4 at,0,1,0,0,0
144,So sánh Hyundai Tucson 2020 và Mazda CX-5 2020 cho nhu cầu gia đình,"xét về kích_thước rộng x cao , hyundai tucson có thông_số 1.850 x 1.660 ( mm ) , trong khi đối_thủ mazda cx - 5 có thông_số 1.840 x 1.680 ( mm )",0,1,0,0,0
532,So sánh xe Toyota Fortuner 2020 và Peugeot 5008 2020: Chất thực dụng xe Nhật đấu tiện nghi xe châu Âu,"bước vào khoang lái , toyota_fortuner 2020 được tối_ưu không_gian tốt hơn nên dù chiều rộng bằng đối_thủ nhưng sự thoải_mái là điểm dễ cảm_nhận với người dùng",0,1,0,0,0
191,So sánh Mitsubishi Xpander AT 2021 và Toyota Innova 2.0G 2021: Cuộc cạnh tranh xe chạy dịch vụ tại Việt Nam,"thế nhưng , mitsubishi_xpander lại có trọng_lượng nhẹ hơn innova nên khả_năng vận_hành cũng không phải là điều quá lo_ngại",0,1,0,0,0
141,So sánh Hyundai SantaFe 2019 và Mitsubishi Pajero Sport 2019,"mẫu suv nhật_bản có phần nhỉnh hơn về trang_bị an_toàn khi được bố_trí lên tới 7 túi khí , bổ_sung hệ_thống kiểm_soát lực kéo hoạt_động cùng với hệ_thống cân_bằng điện_tử",0,0,0,0,1
170,So sánh Mazda CX-5 2.0 Deluxe và Toyota Corolla Cross 1.8V,"về kích_thước , mazda cx - 5 2.0 deluxe hoàn_toàn vượt_trội so với toyota_corolla cross 1.8 v ở hầu_hết mọi thông_số",0,1,0,0,0
534,So sánh xe Toyota Fortuner Legender 2020 và Ford Everest Titanium 2020: Cuộc chiến công nghệ,"sang đến phần thân , chiếc ford everest 2020 tỏ ra bề_thế , vượt_trội hoàn_toàn so với đối_thủ nhờ thông_số kích_thước lớn , duy có khoảng sáng gầm fortuner ấn_tượng nhất phân khúc đạt 279 mm",0,1,0,0,0
440,So sánh xe MG HS 2020 và Hyundai Tucson 2020: Cuộc chiến xe CUV dưới 1 tỷ đồng tại Việt Nam,"theo công_bố , mg hs 2020 là một trong những chiếc xe an_toàn nhất phân khúc nhờ sở_hữu nhiều công_nghệ tiên_tiến",0,0,0,0,1
384,So sánh xe Honda City Top 2018 và Honda Jazz RS 2018: Gừng càng già càng cay,"honda city hiện đang bán ra ở việt_nam với 2 phiên_bản , trong đó phiên_bản city 1.5 top ban_đầu có_giá cao hơn nhưng nay đã giảm_giá xuống còn dưới 600 triệu đồng",0,0,1,0,0
329,So sánh trang bị trên Honda Civic 2021 và Mazda3 2021,"với giá bán chênh_lệch 80 triệu đồng , mazda3 2.0 l signature premium lắp_ráp trong nước rõ_ràng có lợi_thế cạnh_tranh hơn hẳn so với honda civic rs",0,0,1,0,0
453,"So sánh xe Mazda 3 2020 và Kia Cerato 2020: ""Ngôi vương"" dần đổi chủ","trong khi đó , kia_cerato chinh_phục người dùng việt_nam bởi mức giá rẻ nhất phân khúc cùng ngoại_hình trẻ_trung , những trang_bị tiện_nghi cũng như công_nghệ của xe ở mức đủ dùng trong tầm giá",0,0,1,0,0
442,"So sánh xe MG ZS 2021 và Ford EcoSport 2021: ""Tân binh"" đủ sức thay thế ""cựu vương""","ở chiều ngược_lại , ford ecosport 2021 có khả_năng cách_âm ở mức trung_bình so với mặt_bằng chung của phân khúc",0,0,0,1,0
22,Chọn SUV 7 chỗ nào giữa Ford Everest 2019 và Mitsubishi Pajero Sport 2019?,tương_tự như everest thì pajero_sport 2019 cũng được trang_bị 7 túi khí an_toàn,0,0,0,0,1
377,So sánh xe Honda CR-V 2021 và Mitsubishi Outlander 2021,"ở chiều ngược_lại , cr - v sở_hữu chiều rộng tổng_thể tốt hơn",0,1,0,0,0
333,So sánh trang bị trên MG HS 2021 và Honda CR-V 2021,"hiện_tại , mg việt_nam tiếp_tục nhập_khẩu nguyên chiếc mg hs từ trung_quốc với 3 phiên_bản với giá bán và giá lăn bánh như sau : • mg hs 1.5 t_std ( 2wd sport ) : 719 triệu đồng ( giá lăn bánh hn : 828 triệu đồng , giá lăn bánh tphcm : 813 triệu đồng ) • mg hs 1.5 t_lux ( 2wd trophy ) : 829 triệu đồng ( giá lăn bánh hn : 951 triệu đồng , giá lăn bánh tphcm : 934 triệu đồng ) • mg hs 2.0 t_lux ( awd trophy ) : 949 triệu đồng ( giá lăn bánh hn : 1,085 tỷ đồng , giá lăn bánh tphcm : 1,066 tỷ đồng ) trong bài so_sánh này , chúng_ta sẽ đặt lên bàn cân 2 phiên_bản có mức giá trên_dưới 1 tỷ đồng là honda cr - v_e và mg hs 2.0 t_lux ( awd trophy ) để xem đâu là dòng xe đáng cân_nhắc hơn ? vậy chúng_ta cùng theo_dõi các bảng so_sánh theo các hạng_mục dưới đây : với giá bán chênh_lệch 39 triệu đồng triệu đồng , mg hs 2021 rõ_ràng có lợi_thế cạnh_tranh hơn hẳn so với honda cr - v_e",0,0,1,0,0
503,"So sánh xe Peugeot Traveller 2019 và Ford Tourneo 2019: Đại chiến MPV ""tân binh""",ford_tourneo 2019 dùng động_cơ xăng ecoboost 2.0 l cùng dung_tích nhưng công_suất lớn hơn ở mức 200 mã_lực và 300 nm mô - men xoắn,1,0,0,0,0
495,So sánh xe Mitsubishi Xpander Cross 2020 và Toyota Rush 2020: Ngang giá chọn xe nào?,"ở khía_cạnh thông_số kích_thước tổng_thể , mitsubishi xpander cross 2020 đều tỏ ra vượt_trội hơn đối_thủ ở tất_cả các chỉ_số",0,1,0,0,0
200,So sánh Suzuki Ertiga Sport 2021 và Mitsubishi Xpander AT 2021 - Chọn giá rẻ hay trang bị tốt hơn?,"màn_hình cảm_ứng trên suzuki ertiga sport lớn hơn với kích_thước 10 inch , trong khi đó , mitsubishi xpander at có lợi_thế với 6 loa so với 4 loa của đối_thủ",0,1,0,0,0
381,"So sánh xe Honda City 2017 và Toyota Vios 2017: Khi ""ông hoàng sedan"" đối đầu kẻ thù truyền kiếp",không chỉ ở nội ngoại_thất mà ngay cả trang_bị của toyota_vios cũng thể_hiện sự lép_vế trước đối_thủ truyền_kiếp,0,1,0,0,0
369,So sánh xe Honda Brio 2019 và Toyota Wigo 2019: Cuộc chạm trán xe cỡ nhỏ Nhật Bản,"màn_hình giải_trí của wigo có kích_thước nhỉnh hơn với 7 inch , còn brio chỉ có kích_thước 6,2 inch",0,1,0,0,0
497,So sánh xe Nissan Terra 2019 và Ford Everest 2019: Tiền nào của nấy,"2 xe đều có chiều dài cơ_sở là 2.850 mm , tuy_nhiên oto . com . vn vẫn cao hơn một_chút khi sở_hữu khoảng sáng gầm xe lớn hơn đối_thủ 15 mm",0,1,0,0,0
419,"So sánh xe Kia Optima 2019 và Toyota Corolla Altis 2019: Kẻ mạnh về trang bị, kẻ dựa vào thương hiệu","những đường_nét ở cụm đèn hậu thể_hiện sự tinh_tế , cá_tính hơn hẳn so với cụm đèn chữ “ l kép ” của toyota",0,1,0,0,0
453,"So sánh xe Mazda 3 2020 và Kia Cerato 2020: ""Ngôi vương"" dần đổi chủ",""" ngôi vương "" doanh_số đang có sự_biến_động mạnh tại việt_nam khi mazda 3 đang cho thấy sự hụt hơi bởi mức giá cao còn kia_cerato liệu có thế chiếm hoàn_toàn vị_trí dẫn_đầu phân khúc về doanh_số , hãy cùng chờ thêm trong thời_gian tới !",0,0,1,0,0
546,So sánh xe Toyota Vios và Chevrolet Cruze: “Vua bán chạy” đối đầu “sedan của năm”,"xét về giá bán , phiên_bản cao_cấp nhất của toyota_vios rõ_ràng chiếm lợi_thế khi thấp hơn đối_thủ vài chục triệu đồng",0,0,1,0,0
252,So sánh nhanh Honda Civic 2020 và Mazda3 2020,civic rs được đánh_giá cao bởi sức_mạnh vận_hành nhờ động_cơ tăng áp hiện_đại hơn mazda3,1,0,0,0,0
466,So sánh xe Mazda CX-8 2019 và Ford Everest 2019: Ngang giá liệu có ngang chất lượng?,"nhìn_chung , khoang nội_thất của mazda cx - 8 khá vượt_trội so với đối_thủ về tiện_nghi cũng như sự sang_trọng , điểm trừ có_lẽ đến từ hàng ghế thư 3 không thoải_mái như ford_everest",0,1,0,0,0
423,"So sánh xe Kia Seltos 2020 và Ford EcoSport 2020: ""Ngôi vương"" đổi chủ","để cải_thiện sự rộng_rãi bên trong khoang nội_thất , kia seltos 2020 sở_hữu những thông_số chiều rộng và trục cơ_sở ấn_tượng hơn đối_thủ , cùng với đó là khoảng sáng gầm xe tốt nhất phân khúc đến 190 mm",0,1,0,0,0
31,Chọn mua xe ô tô Mercedes-Benz C250 Exclusive và C300 AMG: Cuộc đấu nội bộ!,"nhìn_chung , mercedes - benz c300 amg đang chiếm ưu_thế về mặt thiết_kế ngoại_thất , trang_bị nội_thất và khả_năng vận_hành so với c250_exclusive",1,1,0,0,0
207,So sánh Toyota Camry và Volkswagen Passat: Hai thái cực đối lập trong phân khúc sedan hạng D,"mẫu sedan đến từ đức được trang_bị_động_cơ xăng tăng áp tsi , sản_sinh công_suất tối_đa 177 mã_lực và mô men xoắn cực_đại 250 , thấp hơn chỉ 1 mã_lực so với camry",1,0,0,0,0
476,So sánh xe Mercedes-Benz GLC 300 2020 và Land Rover Discovery Sport 2020 vừa ra mắt Việt Nam,"quan_sát phần thân , land rover discovery sport facelift khá dài so với đối_thủ glc 300 dù kích_thước chỉ nhỉnh hơn 100 mm",0,1,0,0,0
318,So sánh nhanh Toyota Vios và Suzuki Ciaz,"sau khi nhận được sự nâng_cấp đáng_kể về tính_năng an_toàn , vios 1.5 g nay đã có_thể tự_tin hơn khi so_kè cùng các đối_thủ trong phân khúc ở hạng_mục này với phanh abs / ebd / ba",0,0,0,0,1
440,So sánh xe MG HS 2020 và Hyundai Tucson 2020: Cuộc chiến xe CUV dưới 1 tỷ đồng tại Việt Nam,"mg hs 2020 có phần chiều dài cơ_sở lớn , chiều cao thấp nên khi nhìn từ thân xe sẽ dài hơn đối_thủ khá nhiều",0,1,0,0,0
466,So sánh xe Mazda CX-8 2019 và Ford Everest 2019: Ngang giá liệu có ngang chất lượng?,"xét về giá bán , mazda cx - 8 2019 đang cao hơn đáng_kể so với toyota_fortuner 2019",0,0,1,0,0
29,"Chọn hatchback 550 triệu, nên mua Honda Jazz 2018 hay Toyota Yaris 2017?","ở phía đối_thủ , yaris trông mềm_mại hơn và gần như_không thay_đổi nhiều chi_tiết ngoại_thất so với phiên_bản 2016",0,1,0,0,0
194,So sánh Mitsubshi Mirage 2019 và Kia Morning 2019,"tuy_nhiên mitsubishi mirage được trang_bị hộp_số cvt , cho cảm_giác chuyển số mượt và êm hơn so với loại số tự_động trên kia_morning kia_morning nhỉnh hơn do được trang_bị camera lùi mirage có khả_năng tiết_kiệm nhiên_liệu tốt hơn",0,0,1,0,0
468,So sánh xe Mazda CX-8 2019 và Hyundai Santa Fe 2019,"về phía hyundai santa_fe 2019 , khoang cabin của mẫu xe đồng_hương với cx - 8 cũng được đánh_giá cao với nhiều trang_bị tiện_nghi bậc nhất phân khúc",0,0,0,1,0
114,So sánh Ford EcoSport và Suzuki XL7 cho gia đình trẻ,chiều dài cơ_sở của xl7 cũng nhỉnh hơn 221 mm,0,1,0,0,0
82,Mua xe gia đình chọn KIA Souluto 2020 hay Hyundai Accent 2020?,"bảng so_sánh về trang_bị an_toàn trên 2 phiên_bản at cho thấy , soluto có phần kém thuyết_phục hơn bởi thiếu_vắng khá nhiều trang_bị",0,0,0,0,1
481,So sánh xe Mitsubishi Pajero Sport 2017 và Ford Everest 2017: So tài SUV 7 chỗ thời đại mới,khi về kích_thước thì có_thể thấy everest 2017 khá nổi_trội so với đối_thủ nhờ chiều dài cơ_sở lớn cùng các thông_số cao hơn hẳn,0,1,0,0,0
372,So sánh xe Honda CR-V 2018 và Toyota RAV4 2018 bản quốc tế,"đối_với bản cơ_sở , cr - v 2.4 l tiết_kiệm nhiên_liệu hơn rav4 với các con_số tương_ứng là 9,0 - 7,3 lít / 100km",0,0,0,1,0
506,So sánh xe Subaru Forester GT Edition 2020 và Peugeot 3008 2020: Ngang giá ngang chất lượng,"trong phân khúc cuv tại việt_nam , subaru forester gt edition 2020 sở_hữu nhiều trang_bị an_toàn nhất",0,0,0,0,1
434,"So sánh xe Kia Sportage 2016 và Hyundai Tucson 2016: ""Gà cùng một mẹ""","sportage 2016 không_những chiếm ưu_thế về giá bán tốt nhất phân khúc mà còn sở_hữu danh_sách các trang_bị vượt_trội hơn đối_thủ mặc_dù cả hai mẫu xe này đều được nhập_khẩu nguyên chiếc từ hàn_quốc , đều phát_triển trên cùng hệ khung gầm và động_cơ",0,0,1,0,0
455,"So sánh xe Mazda 3 2020 với Honda Civic RS 2020: Cùng thể thao, cùng đắt","ở phần thân xe , cả 2 mẫu xe đến từ nhật_bản đều được trang_bị bộ la - zăng kích_thước 18 inch đa chấu , nhưng civic có vẻ thể_thao hơn khi được sơn đen còn mazda 3 là màu bạc khá đơn_giản",0,1,0,0,0
436,So sánh xe Kia Sportage 2016 và Mitsubishi Outlander Sport 2016 - Đã hết thời xe Hàn lép vế,"tuy_nhiên outlander_sport lại có lợi_thế nhờ vào hệ khung gầm vững_chắc , ngoài ra_chiều dài cơ_sở , bán_kính vòng quay và khoảng sáng gầm xe của mẫu xe nhật đều lớn hơn đối_thủ",0,1,0,0,0
399,So sánh xe Hyundai Grand i10 2017 và Kia Morning 2017: Ô tô 400 triệu nào tốt nhất?,"nhìn_chung , dù đã chuyển về lắp_ráp trong nước nhưng grand i10 vẫn có_giá cao hơn tới 33 triệu đồng so với morning",0,0,1,0,0
482,So sánh xe Mitsubishi Pajero Sport 2020 và Toyota Fortuner 2020,"đối_với toyota_fortuner 2020 , chiếc xe này cũng sử_dụng động_cơ dầu 2.4 l , nhưng công_suất thấp hơn đáng_kể so với đối_thủ",1,0,0,0,0
106,Sedan hạng C đối đầu: Honda Civic 1.5L hay Toyota Corolla Altis Sport 2.0L nổi trội hơn?,"nếu so những thông_số đã được công_bố , có_thể thấy kích_thước tổng_thể của honda civic 1.5 l lớn hơn so với toyota_corolla altis sport 2.0 l",0,1,0,0,0
241,So sánh nhanh Honda Accord với Mazda6,"về mặt trang_bị_động_cơ thì honda accord vượt_trội hơn khi được trang_bị_động_cơ tăng áp 1.5 l , có dung_tích nhỏ hơn , đỡ hao xăng hơn nhưng lại mạnh_mẽ hơn 3 mã_lực và 10 nm so với mazda6 2.5 l_premium",1,0,0,0,0
290,So sánh nhanh Mitsubishi Mirage 2020 và Suzuki Swift 2020,"như_vậy , swift nhỉnh hơn cả về chiều rộng lẫn chiều cao nên có phần bề_thế hơn đôi_chút khi 2 xe đặt cạnh nhau",0,1,0,0,0
146,So sánh Hyundai i10 2021 và Vinfast Fadil 2021,"động_cơ 1.4 l kết_hợp với hộp_số vô cấp cvt mang đến cho fadil khả_năng vận_hành êm_ái , nhàn_nhã và linh_hoạt hơn đối_thủ hàn_quốc",1,0,0,0,0
560,Toyota Camry 2.5Q 2019 vẫn có nhiều điểm đáng chọn dù đắt hơn Mazda 6 Premium 2.5L 2019 tới 208 triệu đồng,"so với toyota_camry , cụm đèn hậu trên mẫu mazda 6 không được ấn_tượng bằng",0,1,0,0,0
491,So sánh xe Mitsubishi Xpander 2020 và Suzuki XL7 2020: XL7 liệu có ngáng đường Xpander?,"nhìn ngang từ phần thân xe , xpander đang tỏ ra trường xe hơn nhờ thông_số chiều dài ấn_tượng hơn xl7",0,1,0,0,0
