sentence_idx,title,main,sức_mạnh,thiết_kế,giá,tính_năng,an_toàn
220,"So sánh VinFast Lux SA2.0 2021 và Kia Sorento 2021: Lựa chọn nào trong tầm giá 1,5 tỷ đồng","tuy_nhiên , với đội_ngũ so_sánh xe chúng_tôi , thiết_kế màn_hình xe cần thay_đổi bởi nó không thực_sự ấn_tượng như nhiều đối_thủ",0,1,0,0,0
491,So sánh xe Mitsubishi Xpander 2020 và Suzuki XL7 2020: XL7 liệu có ngáng đường Xpander?,"đó là nhờ xe có chiều dài nội_thất lên tới 2.840 mm và trục cơ_sở lớn đến 2.775 mm , thông_số trên vượt_trội so với đối_thủ xl7",0,1,0,0,0
527,So sánh xe Toyota Fortuner 2017 và Ford Everest 2016 - Vua doanh số đối đầu vua chất lượng,"nhờ sử_dụng động_cơ dung_tích 3.2 lít , ford everest có sức_mạnh lớn hơn đối_thủ tới 34 mã_lực và 225 nm",1,0,0,0,0
52,Honda CR-V 2018 và Ford Escape 2018: Crossover nào tốt nhất khi mua ở Việt Nam?,honda cr - v 2018 5 chỗ sở_hữu một trong những khoang nội_thất rộng_rãi nhất phân khúc,0,1,0,0,0
145,So sánh Hyundai Tucson với Kia Sportage,trang_bị an_toàn kém hơn so với đối_thủ kia sportage 2.0 4wd,0,0,0,0,1
79,"Mua xe gia đình 650 triệu, chọn Hyundai Kona 2019 hay Toyota Rush 2019 tốt hơn?","tuy_nhiên , cũng phải nói rằng do dung_tích xi - lanh lớn nên mức tiêu_thụ nhiên_liệu của kona cũng hao hơn đối_thủ",0,0,0,1,0
106,Sedan hạng C đối đầu: Honda Civic 1.5L hay Toyota Corolla Altis Sport 2.0L nổi trội hơn?,"theo đó , toyota_corolla altis sport 2.0 l có tấm lưới tản_nhiệt mỏng được mạ crom sáng bóng và nối_liền cụm đèn_pha , tạo cảm_giác phần đầu thoáng và rộng hơn",0,1,0,0,0
511,So sánh xe Suzuki Ertiga Sport 2020 và Toyota Avanza 2020: Ertiga Sport đã rẻ lại nhiều trang bị,"tuy_nhiên , chúng_tôi vẫn đánh_giá cao chất_liệu nỉ trên suzuki ertiga sport hơn , nó không bị quá rẻ_tiền như những gì xuất_hiện trên avanza",0,1,0,0,0
494,So sánh xe Mitsubishi Xpander Cross 2020 và Suzuki XL7 2020: Đại chiến MPV lai SUV tại Việt Nam,"tại thị_trường việt_nam , suzuki xl7 2020 là chiếc mpv lai suv sở_hữu mức giá rẻ nhất",0,0,1,0,0
574,"Với 540 triệu, Mazda 2 2018 hay Hyundai Accent 2018 đáng mua hơn?",mazda 2 không có đèn hậu độc_đáo như đối_thủ,0,1,0,0,0
576,"Với 900 triệu đồng, nên mua Mazda CX-5 2019 hay Honda HR-V L 2019?","về kích_thước , mazda cx - 5 thuộc dòng crossover nên sở_hữu_vẻ ngoài to_lớn , đồ_sộ hơn hẳn đối_thủ hr - v",0,1,0,0,0
208,So sánh Toyota Fortuner 2019 và Mitsubishi Pajero Sport 2019,"tuy_nhiên , pajero_sport lại có thông_số chiều dài cơ_sở vượt_trội hơn so với fortuner",0,1,0,0,0
224,So sánh nhanh  Honda Brio 2020 và Hyundai i10 2020 ,"tuy_nhiên đổi lại , honda brio có_giá bán cao hơn nhưng lại là xe nhập nguyên chiếc",0,0,1,0,0
471,So sánh xe Mercedes V-Class 2019 và Peugeot Traveller 2019: Nên mua MPV hạng sang nào cho phải?,"như_vậy , giá bán của traveller thấp hơn khá nhiều so với đối_thủ nên chắc_chắn sẽ là một lựa_chọn khá hấp_dẫn",0,0,1,0,0
375,So sánh xe Honda CR-V 2020 và Mitsubishi Outlander 2020: Đại chiến CUV tại Việt Nam,"động_cơ trên mang đến sức_mạnh 188 mã_lực và cũng với cx - 5 , crv là xe có sức_mạnh lớn nhất phân khúc cuv tại việt_nam",1,0,0,0,0
440,So sánh xe MG HS 2020 và Hyundai Tucson 2020: Cuộc chiến xe CUV dưới 1 tỷ đồng tại Việt Nam,kích_thước màn_hình nhỏ hơn nhưng tucson mang đến trải nghiệm mượt mà hơn hẳn đối_thủ,0,1,0,0,0
468,So sánh xe Mazda CX-8 2019 và Hyundai Santa Fe 2019,các tính_năng an_toàn trên mazda cx - 8 được đánh_giá là đầy_đủ nhất phân khúc tại việt_nam,0,0,0,0,1
268,So sánh nhanh Hyundai Tucson 2020 và Mazda CX-5 2020,"tuy_nhiên với chiều dài cơ_sở ngắn hơn 30mm , hyundai tucson linh_hoạt hơn với bán_kính quay_vòng 5,3 mét",0,1,0,0,0
306,So sánh nhanh Suzuki Swift 2019 và Honda Jazz 2019,trang_bị an_toàn cơ_bản với các tính_năng abs / ebd / ba tương_tự các mẫu xe cùng tầm tiền,0,0,0,0,1
224,So sánh nhanh  Honda Brio 2020 và Hyundai i10 2020 ,như_vậy honda brio có động_cơ mạnh_mẽ hơn i10,1,0,0,0,0
137,So sánh Hyundai Kona 2020 và Ford EcoSport 2020,"cùng sử_dụng động_cơ xăng với công_nghệ tăng áp , tuy_nhiên với dung_tích lớn hơn nên động_cơ trên hyundai kona cho sức_mạnh vượt_trội hơn 50 mã_lực và 95 nm",1,0,0,0,0
466,So sánh xe Mazda CX-8 2019 và Ford Everest 2019: Ngang giá liệu có ngang chất lượng?,"ở bên đối_diện , ford_everest 2019 phát_triển với phong_cách cứng_cáp hơn nhờ đuôi xe bề_thế",0,1,0,0,0
421,So sánh xe Kia Rondo và Suzuki Ertiga - Ai bảo xe Hàn thua xe Nhật?,điểm khác_biệt lớn nhất ở 2 mẫu xe là kia rondo sở_hữu kích_thước lớn hơn rất nhiều,0,1,0,0,0
580,"Xe dành cho phái nữ dưới 650 triệu đồng, chọn Toyota Yaris G 2018 hay Mazda 2 2018?",phiên_bản cao_cấp yaris g còn được trang_bị hệ_thống đèn_chiếu giúp cho người lái có tầm nhìn tốt hơn,0,0,0,1,0
57,"Khoảng giá 450 triệu đồng, mua Honda Brio 2019 hay Kia Soluto 2019?","về tổng_thể , cảm_giác lái của honda brio được đánh_giá cao so với một chiếc xe hạng a , đặc_biệt ít rung lắc khi di_chuyển trên các cung đường khó , di_chuyển linh_hoạt trên các cung đường nhỏ , chật_hẹp trong các khu đô_thị",1,0,0,0,0
432,So sánh xe Kia Sorento 2021 và Toyota Fortuner 2021: Đại chiến xe Hàn - Nhật,"toyota_fortuner 2021 bổ_sung bản legender với ngoại_hình tươi mới , đặc_biệt chiếc xe này đã sở_hữu nhiều công_nghệ an_toàn hơn hẳn so với đời cũ",0,0,0,0,1
461,"So sánh xe Mazda CX-5 2017 và Honda CR-V 2017 thế hệ mới: Ngang sức, ngang tài, ngang tiền","do_vậy , cảm_giác lái mà cx - 5 mang lại là tốt hơn so với cr - v",0,0,1,0,0
193,So sánh Mitsubishi Xpander và Toyota Avanza: Đại chiến MPV tân binh,"mitsubishi xpander sở_hữu kích_thước chiều dài x rộng x cao là 4475 x 1750 x 1700 mm , tức_là lớn hơn toyota_avanza ( 4190 x 1660 x 1695 mm ) khá nhiều , đặc_biệt là ở chiều dài",0,1,0,0,0
220,"So sánh VinFast Lux SA2.0 2021 và Kia Sorento 2021: Lựa chọn nào trong tầm giá 1,5 tỷ đồng",dáng_vẻ bệ_vệ được thể_hiện rõ ở phía sau đuôi xe vinfast lux sa2 . 0 nhờ thông_số kích_thước chiều cao và rộng đều lớn hơn đối_thủ,0,1,0,0,0
215,So sánh Toyota Vios 2021 và Kia Soluto 2021 – Lựa chọn xe số 1 trong lĩnh vực xe chạy dịch vụ?,"ngoài_ra , đèn nội_thất của toyota_vios e mt được trang_bị cho cả 2 hàng ghế , tiện_dụng so với chỉ 1 hàng ghế trước trên kia soluto mt deluxe",0,1,0,0,0
448,So sánh xe Mazda 3 2018 và Ford Focus 2018: Focus hạ giá có đủ sức đối đầu Mazda 3?,nhìn vào có_thể thấy mazda 3 có chiều dài tốt hơn đối_thủ nhưng chiều rộng và cao lại kém lại đối_thủ,0,1,0,0,0
149,So sánh KIA Carens và Suzuki Ertiga: MPV giá rẻ từ 600-650 triệu đồng,"thêm vào đó , hệ_thống đèn led chạy ban_ngày làm cho xe nổi_bật hơn đối_thủ nhật_bản",0,0,0,1,0
465,So sánh xe Mazda CX-5 2019 với Hyundai Tucson 2019,"ở phiên_bản vừa nâng_cấp với gói công_nghệ i - activsense , mazda cx - 5 trở_thành mẫu xe sở_hữu nhiều công_nghệ an_toàn nhất phân khúc",0,0,0,0,1
235,So sánh nhanh Ford EcoSport 2021 và Kia Seltos 2021,"với giá bán cao hơn , kia seltos 2021 sở_hữu số_lượng trang_bị hiện_đại vượt_trội so với ford ecosport 2021",0,0,1,0,0
400,So sánh xe Hyundai Grand i10 2019 và Mitsubishi Attrage 2019: Tầm giá 400 triệu chọn sedan nào cho phải?,nhìn qua có_thể thấy attrage cvt eco có_giá cao hơn i10 at 1.2 l khoảng 60 triệu đồng,0,0,1,0,0
297,So sánh nhanh Mitsubishi Triton MIVEC 2017 và Chevrolet Colorado High Country 2017,"đấu_sĩ nhật_bản không chịu_thua_kém với khả_năng vận_hành linh_hoạt ở nhiều điều_kiện đường_xá khác nhau , ở thành_phố , cao_tốc hay off - road nhờ vô - lăng trợ_lực nhẹ_nhàng , bán_kính quay_vòng 5,9 m ( nhỏ nhất phân khúc ) và bốn chế_độ gài cầu khác nhau",1,0,0,0,0
392,So sánh xe Honda HR-V và Hyundai Kona: SUV đô thị mới nào có thể lật đổ Ford Ecosport?,nếu so_sánh thông_số này có_thể thấy hyundai kona có sức_mạnh vận_hành lớn hơn so với honda hr - v,1,0,0,0,0
37,Cân nhắc VinFast LUX SA2.0 2019 và Hyundai SantaFe 2019 trong tầm tiền 1.5 tỷ,"cả 2 mẫu xe đều được lắp_ráp trong nước với giá niêm_yết như sau : như_vậy , mẫu suv của vinfast hiện có_giá cao hơn so với hyundai santafe máy xăng bản cao_cấp 229 triệu",0,0,1,0,0
109,"So sánh Chevrolet Captiva Revv và Hyundai SantaFe 2016 - Kẻ tám lạng, người nửa cân","chevrolet captiva revv sở_hữu kích_thước 4.673 x 1.868 x 1.756 mm , thua_kém khá nhiều so với santafe ( 4.690 x 1.880 x 1.680 ) nhưng lại có không_gian khá thoải_mái nhờ cách bố_trí ghế ngồi hợp_lí cùng chiều dài cơ_sở lớn hơn 7mm",0,1,0,0,0
582,"Xe đa dụng 7 chỗ, chọn Toyota Innova 2018 hay Kia Sedona 2019 mới?","theo đó , kia_sedona 2019 sở_hữu không_gian xe rộng_rãi hơn , ngoại_thất hiện_đại hơn và được trang_bị thêm nhiều tính_năng nổi_bật",0,1,0,0,0
277,So sánh nhanh Isuzu D-max 4x2 và Mitsubishi Triton 4x2,"nhìn từ bên cạnh , d - max “ kém ” hơn đối_thủ đôi_chút khi không có hai đường gân dập nổi",0,1,0,0,0
346,So sánh xe Brilliance V7 2020 và MG HS 2020: Xe Trung Quốc đại chiến,"so với đại đa_số các mẫu xe đồng_hương khác , mg hs có mức giá bán tương_đối cao dành cho 2 phiên_bản tại việt_nam_cụ_thể như sau : khách_hàng có_thể đặt mua những mẫu xe trên trực_tiếp tại đây : brilliance v7 và mg hs đều là những mẫu xe có hơi_hướng thiết_kế ngoại_hình hiện_đại , trẻ_trung để hướng đến nhiều đối_tượng khách_hàng hơn",0,0,1,0,0
156,So sánh Kia Morning 2021 và Hyundai i10 2021,"như_vậy , i10 hoàn_toàn vượt_trội so với morning về kích_thước",0,1,0,0,0
566,"Tầm 600 triệu đồng, chọn mua Toyota Vios 2019 hay Suzuki Swift 2019?","với cấu_hình sedan , toyota_vios sở_hữu thân xe dài hơn so với đối_thủ , nhưng lại nhỏ hơn về chiều rộng và chiều cao",0,1,0,0,0
288,So sánh nhanh Mitsubishi Attrage 2020 và Kia Soluto 2020,"xét về kích_thước tổng_thể , có_thể thấy mitsubishi attrage 2020 nhỉnh hơn đôi_chút so với soluto về thông_số kích_thước chiều dài , rộng , cao và khoảng sáng gầm xe",0,1,0,0,0
56,Hơn 800 triệu đồng chọn Hyundai Tucson 2020 hay Toyota Corolla Cross 2020?,"không có quá nhiều công_nghệ an_toàn như đối_thủ nên tay_lái của tucson chỉ có những phím chức_năng cơ_bản như điều_chỉnh âm_lượng , ra_lệnh giọng nói , chuyển kênh radio . .",0,0,0,0,1
427,"So sánh xe Kia Seltos Premium 2021 và Peugeot 2008 GT Line 2021: Cuộc chiến SUV đô thị ""hot"" tại Việt Nam","ghế lái chỉnh điện , hàng ghế sau chưa có cửa gió điều hòa và không có bệ tỳ tay trung_tâm là yếu điểm so với đối_thủ",0,0,0,1,0
115,So sánh Ford Ecosport 2018 và Chevrolet Trax 2018,"ecosport nổi_bật hơn cả , tuy_nhiên nếu đem ra so_sánh thì chevrolet trax vẫn có những ưu_điểm vượt_trội riêng về công_nghệ và khả_năng vận_hành mạnh_mẽ",1,0,0,1,0
536,So sánh xe Toyota Hiace 2020 và Ford Transit 2020: Xe Mỹ làm chủ cuộc chơi,xin lấy dữ_liệu của ford transit 2020 phiên_bản cao_cấp giá 845 triệu đồng để so_sánh bởi phiên_bản này ít chênh lệnh về giá và có nhiều điểm tương_đồng với toyota_hiace 2020,0,0,1,0,0
180,So sánh Mitsubishi Outlander Sport và Mazda CX-5,"kích_thước của outlander sport được xem là nhỏ nhất trong phân khúc cuv so với các đối_thủ , tuy_nhiên chiều dài cơ_sở lại khá tương_đương",0,1,0,0,0
408,"So sánh xe Hyundai SantaFe 2016 và Mazda CX-5 2016: Đại chiến SUV 1,1 tỷ","dù là dạng suv 7 chỗ nhưng hyundai santafe lại chỉ lắp_đặt động_cơ 2,2 l , kém hơn hẳn dạng 2.5 l của mazda cx - 5 2016",1,0,0,0,0
56,Hơn 800 triệu đồng chọn Hyundai Tucson 2020 hay Toyota Corolla Cross 2020?,"trong khi đó , hyundai tucson 2020 mang đến không_gian rộng_rãi hơn nhờ kích_thước tốt hơn đối_thủ",0,1,0,0,0
191,So sánh Mitsubishi Xpander AT 2021 và Toyota Innova 2.0G 2021: Cuộc cạnh tranh xe chạy dịch vụ tại Việt Nam,"ở bản mới , lưới tản_nhiệt của xe gọn_gàng hơn và sơn đen toàn_bộ để mang đến diện_mạo mới",0,0,0,1,0
200,So sánh Suzuki Ertiga Sport 2021 và Mitsubishi Xpander AT 2021 - Chọn giá rẻ hay trang bị tốt hơn?,mitsubishi_xpander với giá bán cao hơn nhưng tiện_ích đi kèm cũng nhỉnh hơn so với suzuki ertiga_sport,0,0,1,0,0
14,"Chọn Hyundai SantaFe 2019 kèm theo ""lạc"" hay Peugeot 5008 2019?","bên cạnh đó , với hệ dẫn_động 4 bánh toàn thời_gian , phiên_bản cao_cấp nhất của santafe thế_hệ mới sẽ mang đến khả_năng vận_hành trên các loại địa_hình khó vượt_trội hơn so với mẫu suv 7 chỗ của nhà peugeot",1,0,0,0,0
457,So sánh xe Mazda 6 2.5T và Mazda CX-5 2018: Sedan hay crossover?,"theo epa , mazda cx - 5 được đánh_giá là có khả_năng hoạt_động hiệu_quả hơn",1,0,0,0,0
421,So sánh xe Kia Rondo và Suzuki Ertiga - Ai bảo xe Hàn thua xe Nhật?,nếu so_sánh xe kia_rondo và suzuki ertiga về nội_thất thì rõ_ràng thương_hiệu hàn_quốc là cái tên sáng_giá hơn hẳn,0,0,1,0,0
216,"So sánh Toyota Wigo 2019 và Mitsubishi Mirage 2019: Mua xe lần đầu, chọn xe nào?",mitsubishi mirage được định_vị trong phân khúc hạng b nhưng do chốt mức giá khá rẻ nên nó thường được so_sánh với các mẫu xe hạng a,0,0,1,0,0
293,So sánh nhanh Mitsubishi Pajero Sport 2019 và Toyota Fortuner 2019,"về phía pajero_sport , thiết_kế nội_thất đã có bước nhảy_vọt so với thế_hệ 2008",0,1,0,0,0
203,"So sánh Toyota Altis, Honda Civic và Mazda 3 phiên bản 2014","và cũng đã ra_mắt trong năm qua phiên_bản 2014 , và là hai mẫu xe có sự lột_xác hoàn_toàn mang đến cái nhìn mới_mẻ cho người dùng trong khi civic chỉ được xem là một bản nâng_cấp nhẹ so với thế_hệ trước 
 toyota_altis 2014 sở_hữu kích_thước tổng_thể dài x rộng x cao tương_ứng 4.639 x 1.776 x 1.460 ( mm ) và chiều dài trục cơ_sở là 2.700 mm",0,1,0,0,0
577,"Với tầm giá xấp xỉ một tỷ đồng, chọn Mazda 6 2019 hay Kia Optima 2019","tuy_nhiên , không_gian nội_thất của kia_optima sẽ thông_thoáng hơn nhờ vào thông_số kích_thước chiều rộng và chiều cao tốt hơn",0,1,0,0,0
190,So sánh Mitsubishi Triton 4x4 AT và Nissan NP300 Navara VL,"trang_bị an_toàn của nissan np300 navara vl vượt_trội hơn so với mitsubishi triton 4x4 at với nhiều hệ_thống an_toàn chủ_động hơn , tiêu_biểu như hệ_thống cân_bằng điện_tử esc khá đáng_giá , nhờ đó mà giúp chiếc xe vận_hành ổn_định và đáng tin_cậy hơn",0,0,1,0,0
367,"So sánh xe Honda Accord 2019 và Toyota Camry 2019: 1,2 tỷ mua xe Nhật nào cho đúng?","dù có phần mâm hơi nhỏ so với đối_thủ nhưng accord 2.4 at lại có bộ lốp 225 / 50r17 dày hơn , giúp chiếc xe vận_hành êm_ái",1,1,0,0,0
225,So sánh nhanh  KIA Morning 2019 và Toyota Wigo 2019,tính_năng an_toàn của kia morning s có phần trội hơn đối_thủ,0,0,0,0,1
575,"Với 700 triệu, nên mua Mazda 3 2018 hay Hyundai Elantra Sport 2018?","hiện_tại , hyundai elantra sport 2018 có kích_thước không mấy thay_đổi so với thế_hệ trước",0,1,0,0,0
48,"Dưới 400 triệu đồng, chọn Suzuki Celerio 2018 hay Chevrolet Spark LT 2018?",xe được đánh_giá cao về cảm_giác lái so với các xe khác trong cùng phân khúc khi mang đến cho người sử_dụng những trải nghiệm tay_lái tuyệt_vời,1,0,0,0,0
348,So sánh xe Chevrolet Captiva Revv và Isuzu MU-X - Tân binh và phế vương,"về kích_thước , isuzu_mu - x sẽ có lợi_thế hơn nhờ có kích_thước lớn , chiều dài và chiều cao của mẫu xe nhật_bản đều hơn đối_thủ tương_ứng là 152mm và 84mm",0,1,0,0,0
362,So sánh xe Ford Ranger 2016 và Toyota Hilux 2016 ,đấy là chưa kể đến khả_năng tiết_kiệm nhiên_liệu của hilux cũng trội hơn ranger,0,0,0,1,0
66,Mua Mazda 6 2019 hay Toyota Camry 2019 ?,"tuy_nhiên , mazda 6 có lợi_thế tốt hơn rất nhiều về trang_bị giải_trí , sức_mạnh vận_hành và khả_năng hỗ_trợ lái",1,0,0,1,0
411,So sánh xe Hyundai Tucson 2017 CKD và Mazda CX-5 2016: Tân binh liệu có làm nên chuyện?,mazda cx - 5 2016 thì có sự nổi_trội hơn với 2 tùy chọn nội_thất khá đa_dạng,0,1,0,0,0
298,So sánh nhanh Mitsubishi Triton MIVEC 2017 và Mazda BT-50 2016,"ở hạng_mục thiết_bị tiện_nghi , triton mivec tỏ ra nhỉnh hơn bt - 50 3.2 at 4wd",0,0,0,1,0
221,So sánh bộ đôi tân binh phân khúc SUV 7 chỗ: Nissan Terra V 2019 và VinFast LUX SA2.0 cao cấp 2019,"tiếp đến phần thân xe , vinfast lux sa2 . 0 cao_cấp 2019 chiếm ưu_thế với kích_thước lớn hơn so với đối_thủ",0,1,0,0,0
363,So sánh xe Ford Ranger 2021 và Mitsubishi Triton 2021: chọn giá tốt hay máy khỏe?,"phần thùng_xe có kích_thước lớn nhất trong phân khúc với kích_thước chiều dài x chiều rộng x chiều cao lần_lượt là : 1.450 x 1.560 x 450 mm tạo nên không_gian rộng_rãi để chở tải , tuy_nhiên có phần nhỏ hơn so với đối_thủ",0,1,0,0,0
443,So sánh xe MG ZS 2021 và Kia Seltos 2021: Lựa chọn nào SUV đô thị nào tầm giá dưới 650 triệu đồng?,"tuy_nhiên , kia seltos đang nắm giữ chiều dài trục cơ_sở lớn hơn giúp không_gian xe rộng_rãi và khoảng sáng gầm hơn hẳn đối_thủ",0,1,0,0,0
569,Tầm tiền 1 tỷ chọn Hyundai Tucson 2020 hay Honda CR-V 2020?,"trên honda cr - v bản cơ_sở với mức giá cao hơn 43 triệu đồng nhưng hệ_thống đèn trước chỉ là dạng halogen thông_thường , đèn_pha không có tính_năng mở_rộng góc chiếu",0,0,1,1,0
25,Chọn SUV hạng sang cỡ nhỏ nào giữa Audi Q5 và Lexus NX?,không_gian dành cho hàng ghế sau của audi q5 có phần rộng_rãi hơn nhờ vào kích_thước chiều rộng cũng như chiều dài cơ_sở nhỉnh hơn,0,1,0,0,0
146,So sánh Hyundai i10 2021 và Vinfast Fadil 2021,"về không_gian , i10 hoàn_toàn ưu_thế với kích_thước lớn và khoảng_cách trục cơ_sở dài hơn đến 40mm so với đối_thủ",0,1,0,0,0
47,"Cùng tầm giá 750 triệu đồng, chọn sedan Mazda3 2.0L 2018 hay Honda Civic 1.8E 2018?",nếu_như honda civic 1.8 e 2018 đạt chứng_nhận an_toàn 5 sao của tổ_chức đánh_giá xe_hơi đông_nam_á - ncap thì mazda3 2.0 l lại được tổ_chức iihs top safety pick + xếp_hạng an_toàn cao nhất,0,0,0,0,1
512,So sánh xe Suzuki Swift 2019 và Mazda 2 2019: Mua hatchback hạng B nào cho phải?,"chiếc xe của suzuki sở_hữu thân_hình nhỏ gọn , trang_bị khá hấp_dẫn và đặc_biệt là mức giá rẻ hơn đối_thủ tới 60 triệu đồng , đặc_biệt là khi bạn mua phiên_bản cao_cấp nhất của swift",0,0,1,0,0
246,So sánh nhanh Honda CR-V 2020 và Subaru Forester 2020,subaru forester cũng có tính_năng này trên phiên_bản 2.0 i - s nhưng đi kèm là giá bán cao hơn hẳn,0,0,1,0,0
287,So sánh nhanh Mercedes GLS 2020 và BMW X7,"về mặt vận_hành , mercedes gls 2020 sở_hữu khối động_cơ có sức_mạnh nhỉnh hơn đối_thủ bmw x7",1,0,0,0,0
43,"Có tầm 500 triệu đồng, nên mua Mitsubishi Attrage 2018 hay Mazda2 2018?","nhìn_chung , so_sánh xe mitsubishi attrage 2018 và mazda2 2018 về khoang nội_thất , mazda2 có phần trội hơn so với sedan cỡ nhỏ nhập_khẩu thái_lan đến từ nhà mitsubishi",0,1,0,0,0
0, So sánh Lexus LX570 và Infiniti QX80: Thách thức đối thủ đồng hương,"bên cạnh đó , với một bộ mâm có kích_thước lớn hơn lên đến 22 inch , qx80 mang đến góc nhìn thanh_thoát hơn so với lx570 khi nhìn từ hai bên",0,1,0,0,0
432,So sánh xe Kia Sorento 2021 và Toyota Fortuner 2021: Đại chiến xe Hàn - Nhật,"không_những êm_ái , động_cơ dầu của sorento mới còn mang đến những trải nghiệm uy_lực không khác gì máy xăng",1,0,0,0,0
190,So sánh Mitsubishi Triton 4x4 AT và Nissan NP300 Navara VL,trang_bị ngoại_thất navara nhỉnh hơn triton đôi_chút,0,1,0,0,0
134,So sánh Hyundai Elantra Sport 2018 và Honda Civic 2018,"không thua_kém đối_thủ , hyundai mới_đây cũng giới_thiệu đến khách_hàng mẫu xe elantra_sport động_cơ tăng áp dung_tích lớn hơn và giá bán cũng hấp_dẫn hơn khi chỉ nằm ở mức 729 triệu trong khi danh_sách option không kém_cạnh",0,0,1,0,0
498,So sánh xe Nissan X-Trail 2019 và Mazda CX-5 2019: Công nghệ là điểm nhấn,"với mức giá trên , cx - 5 hiện là mẫu xe có_giá bán đắt nhất phân khúc cuv",0,0,1,0,0
574,"Với 540 triệu, Mazda 2 2018 hay Hyundai Accent 2018 đáng mua hơn?","đối_chiếu 2 phiên_bản mazda 2 1.5 at sedan 2018 và hyundai accent 1.4 at đặc_biệt 2018 thì có_thể thấy hyundai accent có_giá bán cao hơn một_chút , chỉ khoảng 11 triệu đồng",0,0,1,0,0
585,Đại chiến SUV nhập khẩu: Toyota Land Cruiser Prado 2018 hay Ford Explorer 2018 tốt hơn?,"nhìn qua cũng thấy sức_mạnh của mẫu xe mỹ hoàn_toàn vượt_trội so với sản_phẩm nhật , dù dung_tích động_cơ bé hơn hẳn",1,0,0,0,0
37,Cân nhắc VinFast LUX SA2.0 2019 và Hyundai SantaFe 2019 trong tầm tiền 1.5 tỷ,"đổi lại , hyundai santafe được trang_bị cửa cốp tự_động đóng mở điện thông_minh thay_vì là loại đóng mở bằng tay như trên mẫu xe của vinfast : so về trang_bị nội_thất thì nhìn_chung , mặc_dù có mức giá rẻ hơn khá nhiều nhưng hyundai santafe bản máy xăng cao_cấp lại sở_hữu danh_sách trang_bị tiện_nghi hấp_dẫn và đầy_đủ hơn",0,0,1,0,0
376,So sánh xe Honda CR-V 2020 và Subaru Forester 2020: Hai CUV ngập tràn công nghệ tại Việt Nam,"mặc_dù vậy , thiết_kế này của subaru forester 2020 vẫn bị coi là khá lạc_hậu so với những đối_thủ hiện_nay",0,1,0,0,0
391,"So sánh xe Honda Civic và Kia K3: Khi ""ma cũ"" không thể bắt nạt ""ma mới""","về khả_năng vận_hành , dù cùng sử_dụng động_cơ dung_tích 2.0 lít nhưng k3 lại có công_suất nhỉnh hơn civic khoảng 6 mã_lực và 4nm",1,0,0,0,0
391,"So sánh xe Honda Civic và Kia K3: Khi ""ma cũ"" không thể bắt nạt ""ma mới""",chiều dài cơ_sở của xe cũng lớn hơn 30mm,0,1,0,0,0
39,Cân nhắc giữa Mazda 6 2018 và Toyota Camry 2018 cho việc phục vụ gia đình,"tuy_nhiên nếu xét tổng_quan hơn thì đây là phiên_bản cao nhất của mazda 6 , trong khi đó là phiên_bản thấp nhất của toyota_camry , nên có_thể nói camry vẫn đang cao_giá hơn so với mẫu xe do trường hải lắp_ráp khá nhiều",0,0,1,0,0
369,So sánh xe Honda Brio 2019 và Toyota Wigo 2019: Cuộc chạm trán xe cỡ nhỏ Nhật Bản,brio mạnh_mẽ hơn với cản sau có kích_thước lớn có các rãnh thoát gió được bố_trí rõ nét,0,1,0,0,0
248,So sánh nhanh Honda City và KIA Rio,"xét về kích_thước , honda city vượt_trội hơn đối_thủ khi sở_hữu chiều dài và chiều cao chênh_lệch lần_lượt là 75mm và 22mm",0,1,0,0,0
330,So sánh trang bị trên Kia Cerato 2021 và Hyundai Elantra 2021,"điều này có_thể cho thấy người tiêu_dùng vẫn chưa sẵn_sàng trả nhiều tiền hơn cho các dòng sedan hạng c đang có trên thị_trường , dù mức giá bán của hyundai elantra cũng chỉ cao hơn đôi_chút so với kia_cerato",0,0,1,0,0
196,So sánh Nissan Terra 2018 và Toyota Fortuner 2018: Liệu tân binh có làm nên chuyện?,"terra có kích_thước chiều dài x rộng x cao tương_ứng là 4882 x 1850 x 1835 mm , tức_là dài hơn 1 chút so với 4795 x 1855 x 1835 mm của fortuner",0,1,0,0,0
